### ISSUE TITLE
TXT Records not Properly Parsed

### ISSUE THREAD

**Issue by Mushoz** [aarond10/https_dns_proxy#31]
Since I have changed my Lede router's DNSMasq to forward the DNS requests to 127.0.0.1:5053, on which https_dns_proxy is running my IPTV stopped working completely. Changing the destination server to 8.8.8.8 instantly fixes the issue. I've captured the DNS request to and response from DNSMasq with the working configuration in which the request is forwarded to google directly, and the same thing where the request is sent to the proxy.

Working setup:

22:18:49.361244 IP 192.168.1.187.60201 > 192.168.1.1.53: 2+ TXT? sap.stb.itvonline.nl. (38)
	0x0000:  4a67 c7cf 4838 0002 9bdd 8780 0800 4500  Jg..H8........E.
	0x0010:  0042 8403 4000 4011 329b c0a8 01bb c0a8  .B..@.@.2.......
	0x0020:  0101 eb29 0035 002e 7bce 0002 0100 0001  ...).5..{.......
	0x0030:  0000 0000 0000 0373 6170 0373 7462 0969  .......sap.stb.i
	0x0040:  7476 6f6e 6c69 6e65 026e 6c00 0010 0001  tvonline.nl.....
22:18:49.369894 IP 192.168.1.1.53 > 192.168.1.187.60201: 2 1/0/0 TXT "SAP/1/224.3.2.6:9875" (71)
	0x0000:  0002 9bdd 8780 4a67 c7cf 4838 0800 4500  ......Jg..H8..E.
	0x0010:  0063 885a 4000 4011 2e23 c0a8 0101 c0a8  .c.Z@.@..#......
	0x0020:  01bb 0035 eb29 004f 846d 0002 8180 0001  ...5.).O.m......
	0x0030:  0001 0000 0000 0373 6170 0373 7462 0969  .......sap.stb.i
	0x0040:  7476 6f6e 6c69 6e65 026e 6c00 0010 0001  tvonline.nl.....
	0x0050:  c00c 0010 0001 0000 03d0 0015 1453 4150  .............SAP
	0x0060:  2f31 2f32 3234 2e33 2e32 2e36 3a39 3837  /1/224.3.2.6:987
	0x0070:  35                                       5

Nonworking setup:

22:22:30.082757 IP 192.168.1.187.34002 > 192.168.1.1.53: 2+ TXT? sap.stb.itvonline.nl. (38)
	0x0000:  4a67 c7cf 4838 0002 9bdd 8780 0800 4500  Jg..H8........E.
	0x0010:  0042 83fd 4000 4011 32a1 c0a8 01bb c0a8  .B..@.@.2.......
	0x0020:  0101 84d2 0035 002e e225 0002 0100 0001  .....5...%......
	0x0030:  0000 0000 0000 0373 6170 0373 7462 0969  .......sap.stb.i
	0x0040:  7476 6f6e 6c69 6e65 026e 6c00 0010 0001  tvonline.nl.....
22:22:30.097732 IP 192.168.1.1.53 > 192.168.1.187.34002: 2 1/0/0 TXT ""SAP/1/224.3.2.6:9875"" (73)
	0x0000:  0002 9bdd 8780 4a67 c7cf 4838 0800 4500  ......Jg..H8..E.
	0x0010:  0065 bb6a 4000 4011 fb10 c0a8 0101 c0a8  .e.j@.@.........
	0x0020:  01bb 0035 84d2 0051 846f 0002 8180 0001  ...5...Q.o......
	0x0030:  0001 0000 0000 0373 6170 0373 7462 0969  .......sap.stb.i
	0x0040:  7476 6f6e 6c69 6e65 026e 6c00 0010 0001  tvonline.nl.....
	0x0050:  c00c 0010 0001 0000 52d4 0017 1622 5341  ........R...."SA
	0x0060:  502f 312f 3232 342e 332e 322e 363a 3938  P/1/224.3.2.6:98
	0x0070:  3735 22                                  75"

To the naked eye, the major difference between the two responses is that with the working setup we get the answer as is, while in the non-working setup the answer is encapsulated by two double quotes. Any idea what might be going wrong with https_dns_proxy?

**Edit:** Sorry for the horrendous formatting of the raw packets. When I insert them into code blocks, the formatting is even worse.

**Edit 2:** Might even be an Issue with Google's DoH. With the verbosity cranked up I am seeing this:

[D] 1523480054.665965 https_client.c:96 CURLINFO_EFFECTIVE_URL: https://dns.google.com/resolve?name=sap.stb.itvonline.nl&type=16
[D] 1523480054.666119 https_client.c:169 Times: 0.000212, 0.000232, 0.000234, 0.000496, 0.015144, 0.015516
[D] 1523480054.666234 main.c:57 buflen 235

[D] 1523480054.666273 main.c:71 Received response for id e434: {"Status": 0,"TC": false,"RD": true,"RA": true,"AD": false,"CD": false,"Question":[ {"name": "sap.stb.itvonline.nl.","type": 16}],"Answer":[ {"name": "sap.stb.itvonline.nl.","type": 16,"TTL": 19929,"data": "\"SAP/1/224.3.2.6:9875\""}]}

The quotes in the answer are present (and escaped with the backslash), so https_dns_proxy seems to be parsing the result just fine. Any idea how I might be able to solve this issue?

**Edit 3:** It is definitely a bug in the parsing of https_dns_proxy. Record type 16 is for arbitrary human-readable text, and hence it is encapsulated by quotation marks. However, the actual information that needs to be send back within the response is the text itself, so without the quotation marks.

**Edit 4:** As a double check, I did the same request to Cloudflare's DoH service via the following url: https://1.1.1.1/dns-query?ct=application/dns-json&name=sap.stb.itvonline.nl&type=16

And as we can see, this response also includes those quotation marks. So it seems to be part of the DoH spec. Because if I send the same request to 8.8.8.8 or 1.1.1.1 I receive the answer without any quotation marks.

**Comment by Snawoot** [comment]
I have same issue

**Comment by aarond10** [comment]
Sorry it took so long. Fixed in 8a409e22e. I have no idea why the json encoding for TXT records would embed the quotes. The RFC says strings should be concatenated but that these are equivalent. I assume they are doing it to allow a perfect reverse mapping back to DNS but that shouldn't be required. In any case, I think the immediate issue is fixed.

**Comment by Snawoot** [comment]
Unfortunately it's not an easy fix. TXT records may contain arbitrary binary string. JSON DNS response contains escaped representation of TXT string like in `dig` output. It looks like `"abc\001"`, where `\001` is an octal representation of byte with value `1`. Therefore, strings also should be properly unescaped before they are sent in DNS response of https_dns_proxy.

**Comment by aarond10** [comment]
Ah, right you are. I'll try to find time for a better fix.

**Comment by vaapicon** [comment]
When there are two TXT fields the middle quotes are still escaped.
- Using https_dns_proxy
` dig @127.0.0.1 -p 5053 s1024._domainkey.yahoo.com TXT`
```
;; ANSWER SECTION:
s1024._domainkey.yahoo.com. 21599 IN	TXT	"k=rsa;  p=MIGfMA0GCSqGSIb3DQEBAQUAA4GNADCBiQKBgQDrEee0Ri4Juz+QfiWYui/E9UGSXau/2P8LjnTD8V4Unn+2FAZVGE3kL23bzeoULYv4PeleB3gfm\"\"JiDJOKU3Ns5L4KJAUUHjFwDebt0NP+sBK0VKeTATL2Yr/S3bT/xhy+1xtj4RkdV7fVxTn56Lb4udUnwuxK4V5b5PdOKj/+XcwIDAQAB; n=A 1024 bit key;"
```
- Using 8.8.8.8
`dig @8.8.8.8 s1024._domainkey.yahoo.com TXT`
```
;; ANSWER SECTION:
s1024._domainkey.yahoo.com. 21599 IN	TXT	"k=rsa;  p=MIGfMA0GCSqGSIb3DQEBAQUAA4GNADCBiQKBgQDrEee0Ri4Juz+QfiWYui/E9UGSXau/2P8LjnTD8V4Unn+2FAZVGE3kL23bzeoULYv4PeleB3gfm" "JiDJOKU3Ns5L4KJAUUHjFwDebt0NP+sBK0VKeTATL2Yr/S3bT/xhy+1xtj4RkdV7fVxTn56Lb4udUnwuxK4V5b5PdOKj/+XcwIDAQAB; n=A 1024 bit key;"
```

**Comment by aarond10** [comment]
Sorry, because of the hacky in-place way I am handling TXT records, this is going to take a little more work to fix. Not a tonne, but I haven't had a chance to get to it yet.

**Comment by aarond10** [comment]
First commit (7978052) is in for basic fix done for the long TXT field issue (multiple character-string segments). 

I haven't supported binary TXT fields yet. (Mostly because I haven't had a chance to set myself up a DNS server with some decent test data.) 

Very sorry about how long this took. Please let me know if you run into troubles.
